RecipeName,Ingredients,Steps,Cuisine,ingredient_text,search_field,cleaned_search_field
Sarson Ka Saag,"['1 large bunch mustard greens (sarson), chopped', '1/2 bunch spinach (palak), chopped', '1/4 bunch bathua (chenopodium) (optional, for taste)', '1-inch ginger, chopped', '2-3 green chilies, chopped', '2 tbsp maize flour (makki ka atta)', 'Salt to taste', 'Tempering (Tadka): 2 tbsp ghee, 1 large onion (finely chopped), 1 tbsp ginger-garlic paste, 1/2 tsp red chili powder, 1/4 tsp asafoetida']","['Wash and chop all the greens.', 'In a pressure cooker, add the greens, chopped ginger, green chilies, salt, and 1/2 cup of water.', 'Pressure cook for 4-5 whistles until the greens are very soft.', 'Let the pressure release. Open the lid and add the maize flour. Blend the greens using an immersion blender (or mash well) to a coarse, thick puree.', 'Simmer the saag for 10-15 minutes on low heat, stirring.', 'For tadka: Heat ghee in a separate pan. Add asafoetida.', 'Add the chopped onion and sauté until deep golden brown.', 'Add ginger-garlic paste and red chili powder. Sauté for 1 minute.', 'Pour this tadka over the cooked saag. Mix well.', 'Serve hot with a dollop of white butter and Makki ki Roti.']",North Indian (Punjabi),"1 large bunch mustard greens (sarson), chopped 1/2 bunch spinach (palak), chopped 1/4 bunch bathua (chenopodium) (optional, for taste) 1-inch ginger, chopped 2-3 green chilies, chopped 2 tbsp maize flour (makki ka atta) Salt to taste Tempering (Tadka): 2 tbsp ghee, 1 large onion (finely chopped), 1 tbsp ginger-garlic paste, 1/2 tsp red chili powder, 1/4 tsp asafoetida","Sarson Ka Saag Sarson Ka Saag Sarson Ka Saag 1 large bunch mustard greens (sarson), chopped 1/2 bunch spinach (palak), chopped 1/4 bunch bathua (chenopodium) (optional, for taste) 1-inch ginger, chopped 2-3 green chilies, chopped 2 tbsp maize flour (makki ka atta) Salt to taste Tempering (Tadka): 2 tbsp ghee, 1 large onion (finely chopped), 1 tbsp ginger-garlic paste, 1/2 tsp red chili powder, 1/4 tsp asafoetida",sarson ka saag sarson ka saag sarson ka saag large bunch mustard greens sarson chopped bunch spinach palak chopped bunch bathua chenopodium optional taste inch ginger chopped green chilies chopped tbsp maize flour makki ka atta salt taste tempering tadka tbsp ghee large onion finely chopped tbsp gingergarlic paste tsp red chili powder tsp asafoetida
Makki Ki Roti,"['2 cups maize flour (makki ka atta)', '1/2 tsp ajwain (carom seeds) (optional)', 'Salt to taste', 'Hot water, as needed to knead', 'Ghee for cooking']","['In a bowl, combine the maize flour, ajwain, and salt.', 'Gradually add hot water (as hot as you can handle) and start kneading the dough.', 'Knead for 5-7 minutes. The dough should be soft and smooth. (This dough is gluten-free, so it needs good kneading).', 'Take a small portion of the dough. Knead it again for 30 seconds.', 'Place the dough ball on a piece of parchment paper or a plastic sheet. Wet your palms.', ""Pat the dough with your palms to flatten it into a round circle (roti). It's difficult to roll with a pin."", 'Heat a tava (griddle) over medium heat.', 'Carefully lift the parchment paper and flip the roti onto the hot tava.', 'Cook for about 1 minute, then flip. Cook the other side for 1-2 minutes.', 'Finally, cook it directly on the open flame (optional, for a smoky flavor) or cook on the tava, pressing with a cloth, until brown spots appear.', 'Generously brush with ghee and serve immediately with Sarson Ka Saag.']",North Indian (Punjabi),"2 cups maize flour (makki ka atta) 1/2 tsp ajwain (carom seeds) (optional) Salt to taste Hot water, as needed to knead Ghee for cooking","Makki Ki Roti Makki Ki Roti Makki Ki Roti 2 cups maize flour (makki ka atta) 1/2 tsp ajwain (carom seeds) (optional) Salt to taste Hot water, as needed to knead Ghee for cooking",makki ki roti makki ki roti makki ki roti cups maize flour makki ka atta tsp ajwain carom seeds optional salt taste hot water needed knead ghee cooking
Paneer Tikka (on Tawa),"['250g paneer, cut into 1.5-inch cubes', '1 large onion, cut into 1.5-inch squares', '1 large capsicum (bell pepper), cut into 1.5-inch squares', 'Marinade: 1 cup thick yogurt, 2 tbsp gram flour (besan), 1 tbsp ginger-garlic paste, 1 tsp Kashmiri red chili powder, 1/2 tsp turmeric, 1 tsp garam masala, 1 tsp chaat masala, 1 tbsp lemon juice, 1 tbsp mustard oil, Salt']","['In a bowl, whisk all the ingredients for the marinade until smooth. (Lightly roast the besan for a better taste).', 'Add the paneer cubes, onion squares, and capsicum squares to the marinade.', 'Gently toss to coat everything evenly. Cover and refrigerate for at least 1 hour.', 'Thread the marinated paneer, onion, and capsicum pieces onto wooden skewers (soak skewers in water first).', 'Heat a non-stick tawa (griddle) or pan with 1 tbsp of oil.', 'Place the skewers on the hot tawa. Cook on medium heat.', 'Keep turning the skewers every 2-3 minutes, basting with a little oil, until all sides are golden brown and charred.', 'Sprinkle with chaat masala and serve hot with mint chutney.']",North Indian / Appetizer,"250g paneer, cut into 1.5-inch cubes 1 large onion, cut into 1.5-inch squares 1 large capsicum (bell pepper), cut into 1.5-inch squares Marinade: 1 cup thick yogurt, 2 tbsp gram flour (besan), 1 tbsp ginger-garlic paste, 1 tsp Kashmiri red chili powder, 1/2 tsp turmeric, 1 tsp garam masala, 1 tsp chaat masala, 1 tbsp lemon juice, 1 tbsp mustard oil, Salt","Paneer Tikka (on Tawa) Paneer Tikka (on Tawa) Paneer Tikka (on Tawa) 250g paneer, cut into 1.5-inch cubes 1 large onion, cut into 1.5-inch squares 1 large capsicum (bell pepper), cut into 1.5-inch squares Marinade: 1 cup thick yogurt, 2 tbsp gram flour (besan), 1 tbsp ginger-garlic paste, 1 tsp Kashmiri red chili powder, 1/2 tsp turmeric, 1 tsp garam masala, 1 tsp chaat masala, 1 tbsp lemon juice, 1 tbsp mustard oil, Salt",paneer tikka tawa paneer tikka tawa paneer tikka tawa g paneer cut inch cubes large onion cut inch squares large capsicum bell pepper cut inch squares marinade cup thick yogurt tbsp gram flour besan tbsp gingergarlic paste tsp kashmiri red chili powder tsp turmeric tsp garam masala tsp chaat masala tbsp lemon juice tbsp mustard oil salt
Dum Aloo (Kashmiri),"['500g baby potatoes, boiled and peeled', '1/2 cup plain yogurt, whisked', '1/2 cup mustard oil (for frying)', '2 tbsp ghee', '1 tsp fennel powder (saunf)', '1 tsp dry ginger powder (sonth)', '1 tbsp Kashmiri red chili powder', '1/4 tsp asafoetida (hing)', '1 tsp garam masala', 'Whole spices: 1 black cardamom, 2 green cardamoms, 1-inch cinnamon, 2 cloves', 'Salt to taste']","['Prick the boiled baby potatoes all over with a fork.', 'Heat mustard oil in a pan. Deep fry the potatoes on medium heat until they are golden brown and crisp on the outside. Drain and set aside.', 'In a separate pan, heat 2 tbsp of ghee. Add asafoetida and the whole spices.', 'Lower the heat. Add the Kashmiri red chili powder, followed quickly by the whisked yogurt, stirring constantly to prevent curdling.', 'Add fennel powder, ginger powder, and salt. Cook the masala for 3-4 minutes.', 'Add the fried potatoes and 1.5 cups of water. Bring to a boil.', 'Cover and simmer on low heat for 15-20 minutes, allowing the potatoes to absorb the gravy.', 'The gravy will thicken and become a deep red. Stir in garam masala. Serve hot.']",Kashmiri / North Indian,"500g baby potatoes, boiled and peeled 1/2 cup plain yogurt, whisked 1/2 cup mustard oil (for frying) 2 tbsp ghee 1 tsp fennel powder (saunf) 1 tsp dry ginger powder (sonth) 1 tbsp Kashmiri red chili powder 1/4 tsp asafoetida (hing) 1 tsp garam masala Whole spices: 1 black cardamom, 2 green cardamoms, 1-inch cinnamon, 2 cloves Salt to taste","Dum Aloo (Kashmiri) Dum Aloo (Kashmiri) Dum Aloo (Kashmiri) 500g baby potatoes, boiled and peeled 1/2 cup plain yogurt, whisked 1/2 cup mustard oil (for frying) 2 tbsp ghee 1 tsp fennel powder (saunf) 1 tsp dry ginger powder (sonth) 1 tbsp Kashmiri red chili powder 1/4 tsp asafoetida (hing) 1 tsp garam masala Whole spices: 1 black cardamom, 2 green cardamoms, 1-inch cinnamon, 2 cloves Salt to taste",dum aloo kashmiri dum aloo kashmiri dum aloo kashmiri g baby potatoes boiled peeled cup plain yogurt whisked cup mustard oil frying tbsp ghee tsp fennel powder saunf tsp dry ginger powder sonth tbsp kashmiri red chili powder tsp asafoetida hing tsp garam masala whole spices black cardamom green cardamoms inch cinnamon cloves salt taste
Moong Dal Halwa,"['1 cup yellow moong dal (skinned yellow lentils), soaked for 4 hours', '1 cup ghee', '1 cup sugar', '1 cup milk', '1 cup water', '1/2 tsp cardamom powder', '2 tbsp mixed nuts (almonds, pistachios), slivered']","['Drain the soaked moong dal. Grind it to a coarse paste (without adding water).', 'In a heavy-bottomed pan, heat the ghee.', 'Add the ground moong dal paste to the hot ghee.', 'Stir continuously on low-medium heat. This is the most important step. The dal will first be sticky, then lumpy, and finally will break down into a granular, sand-like texture.', 'Roast for 30-45 minutes, or until the dal paste is golden brown and aromatic, and the ghee separates.', 'While the dal is roasting, combine sugar, milk, and water in a separate saucepan. Bring to a boil.', 'Once the dal is roasted, slowly and carefully pour the hot milk-sugar-water mixture into the pan. It will splutter.', 'Stir vigorously to prevent lumps. The mixture will absorb the liquid quickly.', 'Continue to cook on low heat, stirring, until the halwa thickens and starts to leave the sides of the pan (about 10-15 minutes).', 'Stir in the cardamom powder and nuts. Serve hot.']",Rajasthani / Indian Dessert,"1 cup yellow moong dal (skinned yellow lentils), soaked for 4 hours 1 cup ghee 1 cup sugar 1 cup milk 1 cup water 1/2 tsp cardamom powder 2 tbsp mixed nuts (almonds, pistachios), slivered","Moong Dal Halwa Moong Dal Halwa Moong Dal Halwa 1 cup yellow moong dal (skinned yellow lentils), soaked for 4 hours 1 cup ghee 1 cup sugar 1 cup milk 1 cup water 1/2 tsp cardamom powder 2 tbsp mixed nuts (almonds, pistachios), slivered",moong dal halwa moong dal halwa moong dal halwa cup yellow moong dal skinned yellow lentils soaked hours cup ghee cup sugar cup milk cup water tsp cardamom powder tbsp mixed nuts almonds pistachios slivered
Rasmalai,"['1 liter full-fat milk (for chena)', '2 tbsp lemon juice', 'Syrup: 1 cup sugar, 4 cups water', 'Rabri (Milk): 1 liter full-fat milk, 1/2 cup sugar, 1/2 tsp cardamom powder, 2 tbsp chopped pistachios & almonds, Saffron strands']","[""Make 'chena' (curdled milk solids) from 1 liter of milk and lemon juice, as in the Rasgulla recipe. Squeeze and knead until smooth."", 'Make small, flat discs from the chena.', 'Boil sugar and water in a wide pot. Add the chena discs. Cover and boil for 15-20 minutes. The discs will double in size.', 'Let them cool. Gently squeeze out the syrup.', 'For rabri: In a heavy pan, boil the other 1 liter of milk. Simmer on low heat, stirring often, until it reduces to about half its quantity.', 'Add sugar, cardamom powder, saffron, and nuts to the reduced milk. Stir until sugar dissolves. Let the rabri cool completely.', 'Add the cooled, squeezed chena discs (rasgullas) to the cooled rabri.', 'Chill in the refrigerator for at least 4-6 hours, allowing the discs to soak up the rabri.', 'Serve chilled, garnished with more nuts.']",Bengali / Indian Dessert,"1 liter full-fat milk (for chena) 2 tbsp lemon juice Syrup: 1 cup sugar, 4 cups water Rabri (Milk): 1 liter full-fat milk, 1/2 cup sugar, 1/2 tsp cardamom powder, 2 tbsp chopped pistachios & almonds, Saffron strands","Rasmalai Rasmalai Rasmalai 1 liter full-fat milk (for chena) 2 tbsp lemon juice Syrup: 1 cup sugar, 4 cups water Rabri (Milk): 1 liter full-fat milk, 1/2 cup sugar, 1/2 tsp cardamom powder, 2 tbsp chopped pistachios & almonds, Saffron strands",rasmalai rasmalai rasmalai liter fullfat milk chena tbsp lemon juice syrup cup sugar cups water rabri milk liter fullfat milk cup sugar tsp cardamom powder tbsp chopped pistachios almonds saffron strands
Chicken Kebab (Seekh Kebab),"['500g chicken mince (keema)', '1 large onion, finely chopped and squeezed of all water', '1/4 cup chopped cilantro', '2 green chilies, finely chopped', '1 tbsp ginger-garlic paste', '1 tsp garam masala', '1 tsp cumin powder', '1/2 tsp red chili powder', '1 tbsp gram flour (besan), roasted', '1 tbsp lemon juice', '1 tbsp melted butter', 'Salt to taste']","['In a bowl, combine the chicken mince with all other ingredients (squeezed onion, cilantro, chilies, ginger-garlic, spices, besan, lemon juice, butter, salt).', 'Mix very well, kneading the mixture for 5 minutes.', 'Refrigerate the mixture for at least 1 hour.', 'Grease your palms. Take a portion of the mixture and press it around a metal skewer, shaping it into a long, cylindrical kebab (seekh).', ""Preheat your oven's grill/broiler to high."", 'Place the skewers on a grill rack with a tray underneath.', 'Grill for 10-12 minutes, turning halfway through, until cooked and lightly charred.', 'Alternatively, pan-fry on a tawa, turning, until cooked through.', 'Carefully remove from skewers. Serve hot with mint chutney and onion rings.']",Mughlai / Appetizer,"500g chicken mince (keema) 1 large onion, finely chopped and squeezed of all water 1/4 cup chopped cilantro 2 green chilies, finely chopped 1 tbsp ginger-garlic paste 1 tsp garam masala 1 tsp cumin powder 1/2 tsp red chili powder 1 tbsp gram flour (besan), roasted 1 tbsp lemon juice 1 tbsp melted butter Salt to taste","Chicken Kebab (Seekh Kebab) Chicken Kebab (Seekh Kebab) Chicken Kebab (Seekh Kebab) 500g chicken mince (keema) 1 large onion, finely chopped and squeezed of all water 1/4 cup chopped cilantro 2 green chilies, finely chopped 1 tbsp ginger-garlic paste 1 tsp garam masala 1 tsp cumin powder 1/2 tsp red chili powder 1 tbsp gram flour (besan), roasted 1 tbsp lemon juice 1 tbsp melted butter Salt to taste",chicken kebab seekh kebab chicken kebab seekh kebab chicken kebab seekh kebab g chicken mince keema large onion finely chopped squeezed water cup chopped cilantro green chilies finely chopped tbsp gingergarlic paste tsp garam masala tsp cumin powder tsp red chili powder tbsp gram flour besan roasted tbsp lemon juice tbsp melted butter salt taste
Mutton Seekh Kebab,"['500g mutton mince (keema), with some fat', '1 large onion, finely chopped and squeezed', '1 tbsp ginger-garlic paste', '2 green chilies, finely chopped', '1/4 cup chopped cilantro', '1 tbsp raw papaya paste (as tenderizer)', '1 tsp garam masala', '1 tsp cumin powder', '1/2 tsp red chili powder', '2 tbsp roasted gram flour (besan)', '1 tbsp melted ghee', 'Salt to taste']","['Combine mutton mince, squeezed onion, ginger-garlic, chilies, cilantro, papaya paste, all spices, besan, ghee, and salt.', 'Knead the mixture for 5-10 minutes until it becomes sticky and holds together.', 'Refrigerate for at least 2 hours.', 'Grease your palms. Take a portion of the mixture and press it around a metal skewer, shaping it into a long kebab.', 'Grill in a preheated oven or on a tawa (as in Chicken Seekh Kebab recipe) until cooked through and charred.', 'Baste with ghee or butter while grilling.', 'Serve hot with mint chutney.']",Mughlai / Appetizer,"500g mutton mince (keema), with some fat 1 large onion, finely chopped and squeezed 1 tbsp ginger-garlic paste 2 green chilies, finely chopped 1/4 cup chopped cilantro 1 tbsp raw papaya paste (as tenderizer) 1 tsp garam masala 1 tsp cumin powder 1/2 tsp red chili powder 2 tbsp roasted gram flour (besan) 1 tbsp melted ghee Salt to taste","Mutton Seekh Kebab Mutton Seekh Kebab Mutton Seekh Kebab 500g mutton mince (keema), with some fat 1 large onion, finely chopped and squeezed 1 tbsp ginger-garlic paste 2 green chilies, finely chopped 1/4 cup chopped cilantro 1 tbsp raw papaya paste (as tenderizer) 1 tsp garam masala 1 tsp cumin powder 1/2 tsp red chili powder 2 tbsp roasted gram flour (besan) 1 tbsp melted ghee Salt to taste",mutton seekh kebab mutton seekh kebab mutton seekh kebab g mutton mince keema fat large onion finely chopped squeezed tbsp gingergarlic paste green chilies finely chopped cup chopped cilantro tbsp raw papaya paste tenderizer tsp garam masala tsp cumin powder tsp red chili powder tbsp roasted gram flour besan tbsp melted ghee salt taste
Hyderabadi Baingan (Bagara Baingan),"['250g small, purple brinjals (eggplants)', 'Masala Paste (roast & grind): 1/4 cup peanuts, 2 tbsp sesame seeds, 2 tbsp grated dry coconut, 1 tsp coriander seeds, 1 tsp cumin seeds', '1 large onion, sliced', '1 tbsp ginger-garlic paste', '1 sprig curry leaves', '1/2 tsp mustard seeds', '1/4 tsp fenugreek seeds (methi)', '1/2 tsp turmeric powder', '1 tsp red chili powder', '1 tbsp tamarind pulp', '1/2 tsp jaggery (optional)', '3 tbsp oil', 'Salt to taste']","['Dry roast peanuts, sesame seeds, coconut, coriander, and cumin seeds separately. Let cool and grind to a smooth paste with a little water.', 'Wash the brinjals. Make two perpendicular slits from the bottom, keeping the stems intact.', 'Heat oil in a pan. Fry the brinjals until the skin shrivels and they are 80% cooked. Remove and set aside.', 'In the same oil, add mustard seeds, fenugreek seeds, and curry leaves.', 'Add the sliced onion and sauté until golden brown.', 'Add ginger-garlic paste and cook for 1 minute.', 'Add the ground masala paste, turmeric, and chili powder. Sauté for 5-7 minutes, until the oil separates.', 'Add the tamarind pulp, jaggery (if using), salt, and 1.5 cups of water. Bring to a boil.', 'Gently add the fried brinjals to the gravy.', 'Cover and simmer on low heat for 10-15 minutes, until the brinjals are fully cooked and gravy has thickened.', 'Serve hot with biryani or roti.']",Hyderabadi / South Indian,"250g small, purple brinjals (eggplants) Masala Paste (roast & grind): 1/4 cup peanuts, 2 tbsp sesame seeds, 2 tbsp grated dry coconut, 1 tsp coriander seeds, 1 tsp cumin seeds 1 large onion, sliced 1 tbsp ginger-garlic paste 1 sprig curry leaves 1/2 tsp mustard seeds 1/4 tsp fenugreek seeds (methi) 1/2 tsp turmeric powder 1 tsp red chili powder 1 tbsp tamarind pulp 1/2 tsp jaggery (optional) 3 tbsp oil Salt to taste","Hyderabadi Baingan (Bagara Baingan) Hyderabadi Baingan (Bagara Baingan) Hyderabadi Baingan (Bagara Baingan) 250g small, purple brinjals (eggplants) Masala Paste (roast & grind): 1/4 cup peanuts, 2 tbsp sesame seeds, 2 tbsp grated dry coconut, 1 tsp coriander seeds, 1 tsp cumin seeds 1 large onion, sliced 1 tbsp ginger-garlic paste 1 sprig curry leaves 1/2 tsp mustard seeds 1/4 tsp fenugreek seeds (methi) 1/2 tsp turmeric powder 1 tsp red chili powder 1 tbsp tamarind pulp 1/2 tsp jaggery (optional) 3 tbsp oil Salt to taste",hyderabadi baingan bagara baingan hyderabadi baingan bagara baingan hyderabadi baingan bagara baingan g small purple brinjals eggplants masala paste roast grind cup peanuts tbsp sesame seeds tbsp grated dry coconut tsp coriander seeds tsp cumin seeds large onion sliced tbsp gingergarlic paste sprig curry leaves tsp mustard seeds tsp fenugreek seeds methi tsp turmeric powder tsp red chili powder tbsp tamarind pulp tsp jaggery optional tbsp oil salt taste
Khaman (Nylon Khaman),"['1.5 cups gram flour (besan), fine', '1/2 tsp citric acid crystals', '1.5 tbsp sugar', '3/4 cup water', '1 tsp ginger-chili paste', 'Salt to taste', '1 tsp Eno fruit salt', 'Tempering: 2 tbsp oil, 1 tsp mustard seeds, 1 sprig curry leaves, 3-4 green chilies (slit), 1/2 cup water, 2 tbsp sugar, 1/4 tsp asafoetida']","['In a bowl, mix besan, citric acid, sugar, ginger-chili paste, and salt. Add 3/4 cup water to make a smooth, lump-free batter.', 'Grease a steaming pan. Boil water in a steamer.', 'Just before steaming, add the Eno fruit salt to the batter and 1 tsp of water on top of it. Stir quickly and vigorously for 10-15 seconds. The batter will become very frothy.', 'Pour immediately into the greased pan.', 'Steam on high heat for 12-15 minutes. Check with a toothpick; it should come out clean.', 'Let the khaman cool for 10 minutes, then invert onto a plate and cut into squares.', 'For tempering: Heat oil. Add mustard seeds, asafoetida, curry leaves, and green chilies. Sauté for 30 seconds.', 'Add 1/2 cup water and 2 tbsp sugar. Bring to a boil.', 'Pour this hot tempering evenly over the khaman pieces.', 'Garnish with cilantro and grated coconut. Serve.']",Gujarati / Indian Snack,"1.5 cups gram flour (besan), fine 1/2 tsp citric acid crystals 1.5 tbsp sugar 3/4 cup water 1 tsp ginger-chili paste Salt to taste 1 tsp Eno fruit salt Tempering: 2 tbsp oil, 1 tsp mustard seeds, 1 sprig curry leaves, 3-4 green chilies (slit), 1/2 cup water, 2 tbsp sugar, 1/4 tsp asafoetida","Khaman (Nylon Khaman) Khaman (Nylon Khaman) Khaman (Nylon Khaman) 1.5 cups gram flour (besan), fine 1/2 tsp citric acid crystals 1.5 tbsp sugar 3/4 cup water 1 tsp ginger-chili paste Salt to taste 1 tsp Eno fruit salt Tempering: 2 tbsp oil, 1 tsp mustard seeds, 1 sprig curry leaves, 3-4 green chilies (slit), 1/2 cup water, 2 tbsp sugar, 1/4 tsp asafoetida",khaman nylon khaman khaman nylon khaman khaman nylon khaman cups gram flour besan fine tsp citric acid crystals tbsp sugar cup water tsp gingerchili paste salt taste tsp eno fruit salt tempering tbsp oil tsp mustard seeds sprig curry leaves green chilies slit cup water tbsp sugar tsp asafoetida
Vegetable Pulao,"['1.5 cups Basmati rice, soaked for 30 minutes', '2 cups mixed vegetables (carrots, peas, beans, potatoes, cauliflower)', '1 large onion, thinly sliced', '1 tbsp ginger-garlic paste', '1/2 tsp cumin seeds', 'Whole spices: 1 bay leaf, 2-inch cinnamon, 4 green cardamoms, 4 cloves, 1 star anise', '1/2 tsp garam masala', '3 cups water or vegetable broth', '2 tbsp ghee or oil', 'Salt to taste']","['Heat ghee/oil in a pot or pressure cooker.', 'Add the cumin seeds and all the whole spices. Sauté for 30 seconds.', 'Add the sliced onion and sauté until golden brown.', 'Add ginger-garlic paste and cook for 1 minute.', 'Add all the mixed vegetables. Sauté on high heat for 3-4 minutes.', 'Add the soaked and drained rice. Sauté gently for 1-2 minutes.', 'Add the water (or broth), salt, and garam masala. Bring to a boil.', 'If in a pot, cover tightly, reduce heat to low, and simmer for 15-18 minutes. If in a pressure cooker, cook for 2 whistles.', 'Let it rest for 10 minutes before opening. Fluff with a fork and serve with raita.']",North Indian,"1.5 cups Basmati rice, soaked for 30 minutes 2 cups mixed vegetables (carrots, peas, beans, potatoes, cauliflower) 1 large onion, thinly sliced 1 tbsp ginger-garlic paste 1/2 tsp cumin seeds Whole spices: 1 bay leaf, 2-inch cinnamon, 4 green cardamoms, 4 cloves, 1 star anise 1/2 tsp garam masala 3 cups water or vegetable broth 2 tbsp ghee or oil Salt to taste","Vegetable Pulao Vegetable Pulao Vegetable Pulao 1.5 cups Basmati rice, soaked for 30 minutes 2 cups mixed vegetables (carrots, peas, beans, potatoes, cauliflower) 1 large onion, thinly sliced 1 tbsp ginger-garlic paste 1/2 tsp cumin seeds Whole spices: 1 bay leaf, 2-inch cinnamon, 4 green cardamoms, 4 cloves, 1 star anise 1/2 tsp garam masala 3 cups water or vegetable broth 2 tbsp ghee or oil Salt to taste",vegetable pulao vegetable pulao vegetable pulao cups basmati rice soaked minutes cups mixed vegetables carrots peas beans potatoes cauliflower large onion thinly sliced tbsp gingergarlic paste tsp cumin seeds whole spices bay leaf inch cinnamon green cardamoms cloves star anise tsp garam masala cups water vegetable broth tbsp ghee oil salt taste
Egg Curry,"['6 large eggs, hard-boiled and peeled', '1 large onion, finely chopped', '2 large tomatoes, pureed', '1 tbsp ginger-garlic paste', '1/2 tsp cumin seeds', '1 tsp coriander powder', '1/2 tsp turmeric powder', '1/2 tsp red chili powder', '1/2 tsp garam masala', '2 tbsp vegetable oil', 'Salt to taste']","['Make small slits in the hard-boiled eggs. (Optional: lightly fry them in 1 tsp of oil until golden spots appear).', 'Heat oil in a pan. Add cumin seeds.', 'Add the chopped onion and sauté until golden brown.', 'Add ginger-garlic paste and cook for 1 minute.', 'Add the tomato puree, turmeric, coriander powder, chili powder, and salt.', 'Cook the masala on medium-low heat until it thickens and oil separates.', 'Add 1.5 cups of water to the pan. Bring the gravy to a boil.', 'Gently slide the hard-boiled eggs into the gravy.', 'Cover and simmer for 8-10 minutes.', 'Stir in the garam masala. Garnish with cilantro and serve hot.']",North Indian,"6 large eggs, hard-boiled and peeled 1 large onion, finely chopped 2 large tomatoes, pureed 1 tbsp ginger-garlic paste 1/2 tsp cumin seeds 1 tsp coriander powder 1/2 tsp turmeric powder 1/2 tsp red chili powder 1/2 tsp garam masala 2 tbsp vegetable oil Salt to taste","Egg Curry Egg Curry Egg Curry 6 large eggs, hard-boiled and peeled 1 large onion, finely chopped 2 large tomatoes, pureed 1 tbsp ginger-garlic paste 1/2 tsp cumin seeds 1 tsp coriander powder 1/2 tsp turmeric powder 1/2 tsp red chili powder 1/2 tsp garam masala 2 tbsp vegetable oil Salt to taste",egg curry egg curry egg curry large eggs hardboiled peeled large onion finely chopped large tomatoes pureed tbsp gingergarlic paste tsp cumin seeds tsp coriander powder tsp turmeric powder tsp red chili powder tsp garam masala tbsp vegetable oil salt taste
